{
  "$id": "https://aubaine.io/schema/state.json",
  "title": "État",
  "$schema": "https://json-schema.org/draft/2020-12/schema",
  "type": "object",
  "properties": {
    "key": {
      "type": "string",
      "pattern": "^[a-z][a-z0-9-]*$",
      "description": "Identifiant machine, employé par l'ancre de la planche et par {{clé}} dans un texte de règle."
    },
    "name": {
      "type": "string",
      "minLength": 1,
      "description": "Nom imprimé, et libellé par défaut d'une référence {{clé}} vers cet état. Il doit être unique."
    },
    "kind": {
      "type": "string",
      "enum": [
        "buff",
        "debuff",
        "neutral"
      ],
      "description": "Couleur de la pastille : ce que l'état fait à qui le porte."
    },
    "icon": {
      "type": "string",
      "pattern": "^(mdi|material-symbols|game-icons):[a-z0-9-]+$",
      "description": "Nom Iconify. Sans fichier correspondant dans data/media/icons/, l'état se rend sans icône."
    },
    "color": {
      "description": "Encre propre, lorsque les crans d'une même famille doivent se suivre à l'œil.",
      "type": "string",
      "pattern": "^#[0-9a-f]{6}$"
    },
    "description": {
      "type": "string",
      "minLength": 1,
      "description": "Ce que l'état fait, jusqu'où il s'accumule s'il s'accumule, et comment il prend fin. Quand il n'en fixe pas la durée, le DD ou les dégâts, la Compétence ou l'objet qui l'applique les indique."
    }
  },
  "required": [
    "key",
    "name",
    "kind",
    "icon",
    "description"
  ],
  "additionalProperties": false
}
